メニュー名,内容説明,価格
原生芋と蒸しソラマメのソイマスカルポーネサラダ,長野県産ほうれん草とマッシュルームを使用してソイマスカルポーネを作りました。メープルカシューナッツとあわせて,¥1851（ラージサイズ）/ ¥1501（ハーフサイズ）
ローストチキンのチキンラップサラダ,りんごと胡麻のドレッシングとローストチキン,¥1901（ラージサイズ）/ ¥1551（ハーフサイズ）
きのことかぼちゃのクリームパスタ,きのことかぼちゃのクリームソース,¥1851
有機野菜の濃厚ポタージュ,有機野菜使用、濃厚クリームスープ仕立て,¥401
キッズプレート,大豆ミートの唐揚げ、有機野菜のまぜごはん、フライドポテト、ひとくちデザート、ジュース（りんごorみかん）,¥651
平飼い鶏と季節野菜のサフラン煮込み,平飼い鶏のモモ肉をサフラン風味でじっくり煮込みました。アーモンドのコク深い香りを楽しめる一品です,¥1851/単品¥1601
自家製ひしおのジューシー唐揚げ,国産大豆で作った自家製ひしおに漬け込んだジューシーな唐揚げ,¥1601
豆とトマトのVEGANカレー,有機野菜をたっぷり使用した自家製カレー,¥1751/単品¥1501
大豆ミート麻婆げ油淋鶏風,大豆ミート唐揚げと野菜を特製油淋鶏ソースで,¥1501
